CATS will make you LAUGH YOUR HEAD OFF - Funny CAT compilation,hY7m5jjJ9mM,103582417,430026,84597,45875
Cute and Funny Cat Videos to Keep You Smiling! ,tpiyEe_CqB4,2686532,19298,2111,1159
O JOGO DOS GATOS - CATS: Crash Arena Turbo Stars,S3IMBSQCa7Y,6850,1619,15,357
LIVE: Grace and her newborn kittens!,i2YJF4Yhp1I,3798231,14338,729,0
Must Watch Cat Videos! Cute and Funny Cats ,T0FW9NFRhTU,278006,1964,420,150
Baby Cats - Cute and Funny Cat Videos Compilation #21 | Aww Animals,cytJLvf-eVs,13135057,98654,20212,1814
The Best Cute and Funny Cat Videos This Week! ,Lq8bpo9KWa8,743026,4727,583,336
Baby Cats - Cute and Funny Cat Videos Compilation #27 | Aww Animals,-8JQB_wXjmk,5060299,35568,14178,1121
CATS  - Official Trailer [HD],FtSd844cI7U,17141811,138209,362173,107575
Funny Cats  Mother cats protecting their cute kittens #81,KB-s_p4eIHE,265376,2202,129,66
